{
  "schema_version": "2.0",
  "date": "2026-06-13",
  "briefing_type": "weekend",
  "language": "de",
  "timezone": "Europe/Zurich",
  "data_classification": "verified-live",
  "market_status": "normal",
  "headline": "Die Märkte zeigen sich in einem Zustand moderater Expansion, angeführt von einem starken europäischen Tech-Sektor (ESTX50 +2.16%). Das Makro-Regime ist durch steigende US-Renditen (US10Y +0.54%) und e",
  "market_regime": "Risk-on (zinssensitiv)",
  "market_moves": {
    "ESTX50": {
      "value": 6187.6299,
      "change_pct": 2.16,
      "unit": null,
      "note": null
    },
    "SP500": {
      "value": 7431.46,
      "change_pct": 0.5,
      "unit": null,
      "note": null
    },
    "Nasdaq100": {
      "value": 29635.9492,
      "change_pct": 0.64,
      "unit": null,
      "note": null
    },
    "Dow": {
      "value": 51202.2617,
      "change_pct": 0.7,
      "unit": null,
      "note": null
    },
    "US10Y": {
      "value": 4.487,
      "change_pct": 0.54,
      "unit": "percent",
      "note": null
    },
    "EURUSD": {
      "value": 1.1573,
      "change_pct": 0.32,
      "unit": null,
      "note": null
    },
    "EURCHF": {
      "value": 0.9216,
      "change_pct": 0.14,
      "unit": null,
      "note": null
    },
    "DXY": {
      "value": 99.75,
      "change_pct": -0.11,
      "unit": null,
      "note": null
    },
    "Gold": {
      "value": 4215.0,
      "change_pct": 3.05,
      "unit": null,
      "note": null
    },
    "Brent": {
      "value": 87.33,
      "change_pct": -3.37,
      "unit": null,
      "note": null
    },
    "WTI": {
      "value": 84.88,
      "change_pct": -3.23,
      "unit": null,
      "note": null
    },
    "BTC": {
      "value": 63694.8594,
      "change_pct": 0.24,
      "unit": null,
      "note": null
    },
    "ETH": {
      "value": 1668.79,
      "change_pct": 0.22,
      "unit": null,
      "note": null
    }
  },
  "scorecard": {
    "europe_tech": {
      "score": 2,
      "interpretation": "DAX N/A / ESTX50 +2.16%."
    },
    "us_tech": {
      "score": 1,
      "interpretation": "Nasdaq100 +0.64%."
    },
    "health_rotation": {
      "score": null,
      "interpretation": "Kein Health-Proxy (z.B. XLV) im Snapshot."
    },
    "risk_sentiment": {
      "score": 1,
      "interpretation": "S&P 500 +0.50%."
    },
    "volatility": {
      "score": null,
      "interpretation": "Kein VIX im Snapshot."
    },
    "rates": {
      "score": -1,
      "interpretation": "US10Y +0.54% (steigende Rendite = Gegenwind)."
    },
    "crypto_liquidity": {
      "score": 0,
      "interpretation": "BTC +0.24%."
    }
  },
  "top_themes": [
    {
      "rank": 1,
      "theme": "Anthropic says U.S. suspends foreign access to Fable 5, Mythos 5 AI models",
      "mechanism": "",
      "beneficiaries": [
        "null"
      ],
      "losers": []
    },
    {
      "rank": 2,
      "theme": "First Brands moves ahead with liquidation plan",
      "mechanism": "",
      "beneficiaries": [],
      "losers": []
    },
    {
      "rank": 3,
      "theme": "US blocks foreign access to Anthropic’s most advanced AI models, Axios reports",
      "mechanism": "",
      "beneficiaries": [
        "null"
      ],
      "losers": []
    }
  ],
  "portfolio_themes": {
    "etfs": null,
    "health_ai": null,
    "tech": null,
    "crypto": null,
    "quality": null,
    "cash": null
  },
  "trigger_calendar": [],
  "positioning": {
    "stance": null,
    "overweight": [],
    "neutral": [],
    "underweight": [],
    "what_not_to_do": null,
    "narrative": "(Hypothetische Einschätzung): Übergewichten von europäischem Tech und Gold bei gleichzeitiger Neutralität gegenüber US-Tech-Werten aufgrund regulatorischer Unsicherheit. \n**Was NICHT tun:** Keine neuen Long-Positionen in US-KI-Titeln eingehen, solange die regulatorischen Ermittlungen gegen OpenAI und die Exportbeschränkungen bei Anthropic anhalten."
  },
  "confidence": {
    "level_pct": 30,
    "conviction_pct": 30,
    "conviction_direction": "bullish",
    "data_quality_pct": 95,
    "uncertainty_vectors": [
      "Einzelne Kurse stale: ^GDAXI"
    ]
  },
  "source": {
    "created_by": "ollama/gemma4:26b (aihub)",
    "engine": "ct106-briefing-orchestrator",
    "data_sources": [
      "FRIDAY",
      "yfinance"
    ],
    "note": "Hybrid: Zahlen/Scorecard deterministisch, Prosa via aihub (ollama/gemma4:26b). Prosa ok."
  }
}