{
  "schema_version": "2.0",
  "date": "2026-06-08",
  "briefing_type": "europe_daily",
  "language": "de",
  "timezone": "Europe/Zurich",
  "data_classification": "verified-live",
  "market_status": "normal",
  "headline": "Die globalen Märkte verzeichnen einen signifikanten Risiko-Abverkauf: Der Nasdaq100 fiel um 4.77%, während der S&P 500 mit -2.64% im Minus landet. Das dominierende Makro-Regime ist von steigender Zins",
  "market_regime": "Risk-off / Repricing (Renditedruck)",
  "market_moves": {
    "DAX": {
      "value": 24759.0508,
      "change_pct": -0.75,
      "unit": null,
      "note": null
    },
    "ESTX50": {
      "value": 6062.0698,
      "change_pct": -0.68,
      "unit": null,
      "note": null
    },
    "SP500": {
      "value": 7383.7402,
      "change_pct": -2.64,
      "unit": null,
      "note": null
    },
    "Nasdaq100": {
      "value": 28957.5996,
      "change_pct": -4.77,
      "unit": null,
      "note": null
    },
    "Dow": {
      "value": 50866.7812,
      "change_pct": -1.35,
      "unit": null,
      "note": null
    },
    "US10Y": {
      "value": 4.536,
      "change_pct": 1.32,
      "unit": "percent",
      "note": null
    },
    "EURUSD": {
      "value": 1.1538,
      "change_pct": -0.64,
      "unit": null,
      "note": null
    },
    "EURCHF": {
      "value": 0.9186,
      "change_pct": 0.25,
      "unit": null,
      "note": null
    },
    "DXY": {
      "value": 99.978,
      "change_pct": -0.09,
      "unit": null,
      "note": null
    },
    "Gold": {
      "value": 4333.2998,
      "change_pct": -0.09,
      "unit": null,
      "note": null
    },
    "Brent": {
      "value": 97.15,
      "change_pct": 4.36,
      "unit": null,
      "note": null
    },
    "WTI": {
      "value": 94.26,
      "change_pct": 4.11,
      "unit": null,
      "note": null
    },
    "BTC": {
      "value": 62675.9883,
      "change_pct": 2.97,
      "unit": null,
      "note": null
    },
    "ETH": {
      "value": 1655.8,
      "change_pct": 5.55,
      "unit": null,
      "note": null
    }
  },
  "scorecard": {
    "europe_tech": {
      "score": -1,
      "interpretation": "DAX -0.75% / ESTX50 -0.68%."
    },
    "us_tech": {
      "score": -2,
      "interpretation": "Nasdaq100 -4.77%."
    },
    "health_rotation": {
      "score": null,
      "interpretation": "Kein Health-Proxy (z.B. XLV) im Snapshot."
    },
    "risk_sentiment": {
      "score": -2,
      "interpretation": "S&P 500 -2.64%."
    },
    "volatility": {
      "score": null,
      "interpretation": "Kein VIX im Snapshot."
    },
    "rates": {
      "score": -1,
      "interpretation": "US10Y +1.32% (steigende Rendite = Gegenwind)."
    },
    "crypto_liquidity": {
      "score": 2,
      "interpretation": "BTC +2.97%."
    }
  },
  "top_themes": [
    {
      "rank": 1,
      "theme": "Asia chip stocks slump as AI rally loses steam; Japan, S.Korea worst hit",
      "mechanism": "",
      "beneficiaries": [
        "null"
      ],
      "losers": []
    },
    {
      "rank": 2,
      "theme": "China exports set for strong May on front-loaded orders, chip demand: Reuters poll",
      "mechanism": "",
      "beneficiaries": [
        "null"
      ],
      "losers": []
    },
    {
      "rank": 3,
      "theme": "Introducing CoinW TradFi : Redefining Traditional Asset Trading with Crypto Innovation",
      "mechanism": "",
      "beneficiaries": [
        "null"
      ],
      "losers": []
    }
  ],
  "portfolio_themes": {
    "etfs": null,
    "health_ai": null,
    "tech": null,
    "crypto": null,
    "quality": null,
    "cash": null
  },
  "trigger_calendar": [],
  "positioning": {
    "stance": null,
    "overweight": [],
    "neutral": [],
    "underweight": [],
    "what_not_to_do": null,
    "narrative": "Hypothetisch ist Vorsicht geboten, wobei die Gewichtung von Rohstoffen und Krypto zu erhöhen (Overweight) ist. Wir sehen einen Underweight-Status für breite Tech-Expositionen aufgrund des negativen `us_tech` Scores (-2) und der steigenden Zinskurve. **Was NICHT tun:** Nicht übermäßig auf die kurzfristige Erholung von Technologieaktien spekulieren, da das makroökonomische Umfeld (Rate: -1) durch höhere Renditen belastet wird."
  },
  "confidence": {
    "level_pct": 40,
    "conviction_pct": 40,
    "conviction_direction": "bearish",
    "data_quality_pct": 100,
    "uncertainty_vectors": []
  },
  "source": {
    "created_by": "jarvis-gemma4:latest",
    "engine": "ct106-briefing-orchestrator",
    "data_sources": [
      "FRIDAY",
      "yfinance"
    ],
    "note": "Hybrid: Zahlen/Scorecard deterministisch, Prosa via lokalem Ollama. Prosa ok."
  }
}