{
  "schema_version": "2.0",
  "date": "2026-06-10",
  "briefing_type": "europe_daily",
  "language": "de",
  "timezone": "Europe/Zurich",
  "data_classification": "verified-live",
  "market_status": "normal",
  "headline": "Der Markt präsentiert sich heute von einer signifikanten Divergenz geprägt: Während der Nasdaq100 mit +1.58% eine klare Führung im Technologie-Sektor demonstriert, verzeichnen europäische Indizes wie ",
  "market_regime": "Risk-on / Goldilocks",
  "market_moves": {
    "DAX": {
      "value": 24616.2207,
      "change_pct": -0.58,
      "unit": null,
      "note": null
    },
    "ESTX50": {
      "value": 6062.29,
      "change_pct": 0.0,
      "unit": null,
      "note": null
    },
    "SP500": {
      "value": 7405.73,
      "change_pct": 0.3,
      "unit": null,
      "note": null
    },
    "Nasdaq100": {
      "value": 29414.2598,
      "change_pct": 1.58,
      "unit": null,
      "note": null
    },
    "Dow": {
      "value": 50786.0117,
      "change_pct": -0.16,
      "unit": null,
      "note": null
    },
    "US10Y": {
      "value": 4.552,
      "change_pct": 0.35,
      "unit": "percent",
      "note": null
    },
    "EURUSD": {
      "value": 1.1553,
      "change_pct": 0.21,
      "unit": null,
      "note": null
    },
    "EURCHF": {
      "value": 0.9224,
      "change_pct": 0.25,
      "unit": null,
      "note": null
    },
    "DXY": {
      "value": 99.944,
      "change_pct": -0.11,
      "unit": null,
      "note": null
    },
    "Gold": {
      "value": 4199.5,
      "change_pct": -1.42,
      "unit": null,
      "note": null
    },
    "Brent": {
      "value": 91.67,
      "change_pct": 0.24,
      "unit": null,
      "note": null
    },
    "WTI": {
      "value": 88.46,
      "change_pct": 0.29,
      "unit": null,
      "note": null
    },
    "BTC": {
      "value": 61212.6992,
      "change_pct": -2.98,
      "unit": null,
      "note": null
    },
    "ETH": {
      "value": 1624.99,
      "change_pct": -3.86,
      "unit": null,
      "note": null
    }
  },
  "scorecard": {
    "europe_tech": {
      "score": 0,
      "interpretation": "DAX -0.58% / ESTX50 +0.00%."
    },
    "us_tech": {
      "score": 2,
      "interpretation": "Nasdaq100 +1.58%."
    },
    "health_rotation": {
      "score": null,
      "interpretation": "Kein Health-Proxy (z.B. XLV) im Snapshot."
    },
    "risk_sentiment": {
      "score": 0,
      "interpretation": "S&P 500 +0.30%."
    },
    "volatility": {
      "score": null,
      "interpretation": "Kein VIX im Snapshot."
    },
    "rates": {
      "score": 0,
      "interpretation": "US10Y +0.35% (steigende Rendite = Gegenwind)."
    },
    "crypto_liquidity": {
      "score": -2,
      "interpretation": "BTC -2.98%."
    }
  },
  "top_themes": [
    {
      "rank": 1,
      "theme": "South Korea’s Top Stock Index Crashes, Then Surges on AI Chip Rally",
      "mechanism": "KOSPI swung 16% in 48 hours. Samsung and SK Hynix drove it. Wall Street says nothing fundamental changed and remains positive.",
      "beneficiaries": [
        "KOSPI"
      ],
      "losers": []
    },
    {
      "rank": 2,
      "theme": "Rescuers race to reach trapped after powerful quake in southern Philippines",
      "mechanism": "",
      "beneficiaries": [],
      "losers": []
    },
    {
      "rank": 3,
      "theme": "Asia FX, dollar steady as US-Iran tensions intensify; CPI data ahead",
      "mechanism": "",
      "beneficiaries": [
        "FX"
      ],
      "losers": []
    }
  ],
  "portfolio_themes": {
    "etfs": null,
    "health_ai": null,
    "tech": null,
    "crypto": null,
    "quality": null,
    "cash": null
  },
  "trigger_calendar": [],
  "positioning": {
    "stance": null,
    "overweight": [],
    "neutral": [],
    "underweight": [],
    "what_not_to_do": null,
    "narrative": "Hypothetisch sind wir *Übergewichtet* im globalen Technologie-Sektor (us_tech Score 2). Die anhaltende Stärke des Tech-Sektors rechtfertigt eine positive Gewichtung von Infrastruktur- und KI-Enablern. Wir empfehlen jedoch, die Allokation in rein spekulative oder zyklisch überhitzte Assets zu reduzieren. **Was NICHT getan werden sollte:** Eine Überbetonung auf volatile Anlagen wie Kryptowährungen (BTC -2.98%) oder eine Vernachlässigung der Zinssensitivität durch steigende US10Y-Renditen (+0.35%)."
  },
  "confidence": {
    "level_pct": 0,
    "conviction_pct": 0,
    "conviction_direction": "neutral",
    "data_quality_pct": 100,
    "uncertainty_vectors": []
  },
  "source": {
    "created_by": "jarvis-gemma4:latest",
    "engine": "ct106-briefing-orchestrator",
    "data_sources": [
      "FRIDAY",
      "yfinance"
    ],
    "note": "Hybrid: Zahlen/Scorecard deterministisch, Prosa via lokalem Ollama. Prosa ok."
  }
}