{
  "schema_version": "2.0",
  "date": "2026-06-12",
  "briefing_type": "us_daily",
  "language": "de",
  "timezone": "Europe/Zurich",
  "data_classification": "verified-live",
  "market_status": "normal",
  "headline": "Der Markt zeigt eine deutliche Divergenz: Während der Nasdaq100 mit +3,29 % massiv outperformt, bewegen sich DAX und ESTX50 in einer moderaten Aufwärtsbewegung. Das Makro-Regime bleibt durch starke US",
  "market_regime": "Risk-on / Goldilocks",
  "market_moves": {
    "DAX": {
      "value": 24517.7891,
      "change_pct": 1.27,
      "unit": null,
      "note": null
    },
    "ESTX50": {
      "value": 6135.75,
      "change_pct": 1.3,
      "unit": null,
      "note": null
    },
    "SP500": {
      "value": 7394.2998,
      "change_pct": 1.75,
      "unit": null,
      "note": null
    },
    "Nasdaq100": {
      "value": 29446.1797,
      "change_pct": 3.29,
      "unit": null,
      "note": null
    },
    "Dow": {
      "value": 50848.75,
      "change_pct": 1.86,
      "unit": null,
      "note": null
    },
    "US10Y": {
      "value": 4.463,
      "change_pct": -1.74,
      "unit": "percent",
      "note": null
    },
    "EURUSD": {
      "value": 1.1566,
      "change_pct": 0.26,
      "unit": null,
      "note": null
    },
    "EURCHF": {
      "value": 0.9212,
      "change_pct": -0.17,
      "unit": null,
      "note": null
    },
    "DXY": {
      "value": 99.842,
      "change_pct": -0.02,
      "unit": null,
      "note": null
    },
    "Gold": {
      "value": 4197.8999,
      "change_pct": 2.63,
      "unit": null,
      "note": null
    },
    "Brent": {
      "value": 88.66,
      "change_pct": -1.9,
      "unit": null,
      "note": null
    },
    "WTI": {
      "value": 86.21,
      "change_pct": -1.71,
      "unit": null,
      "note": null
    },
    "BTC": {
      "value": 62946.9219,
      "change_pct": -0.97,
      "unit": null,
      "note": null
    },
    "ETH": {
      "value": 1656.63,
      "change_pct": -0.94,
      "unit": null,
      "note": null
    }
  },
  "scorecard": {
    "europe_tech": {
      "score": 1,
      "interpretation": "DAX +1.27% / ESTX50 +1.30%."
    },
    "us_tech": {
      "score": 2,
      "interpretation": "Nasdaq100 +3.29%."
    },
    "health_rotation": {
      "score": null,
      "interpretation": "Kein Health-Proxy (z.B. XLV) im Snapshot."
    },
    "risk_sentiment": {
      "score": 2,
      "interpretation": "S&P 500 +1.75%."
    },
    "volatility": {
      "score": null,
      "interpretation": "Kein VIX im Snapshot."
    },
    "rates": {
      "score": 2,
      "interpretation": "US10Y -1.74% (steigende Rendite = Gegenwind)."
    },
    "crypto_liquidity": {
      "score": -1,
      "interpretation": "BTC -0.97%."
    }
  },
  "top_themes": [
    {
      "rank": 1,
      "theme": "France’s May inflation rises 2.8% year-over-year",
      "mechanism": "",
      "beneficiaries": [],
      "losers": []
    },
    {
      "rank": 2,
      "theme": "Belgian banks eye stake in Belfius amid government sale plan - report",
      "mechanism": "",
      "beneficiaries": [
        "null"
      ],
      "losers": []
    },
    {
      "rank": 3,
      "theme": "McBride issues profit warning as input costs surge, seals Eurotab deal",
      "mechanism": "",
      "beneficiaries": [
        "MCB"
      ],
      "losers": []
    }
  ],
  "portfolio_themes": {
    "etfs": null,
    "health_ai": null,
    "tech": null,
    "crypto": null,
    "quality": null,
    "cash": null
  },
  "trigger_calendar": [],
  "positioning": {
    "stance": null,
    "overweight": [],
    "neutral": [],
    "underweight": [],
    "what_not_to_do": null,
    "narrative": "(Hypothetische Einschätzung): Übergewichten von US-Tech-Werten bei gleichzeitiger Neutralität gegenüber europäischen Indizes.\n**Regel:** Nicht in Sektoren mit steigenden Inputkosten oder negativen Wachstumsausblicken (wie Signify) investieren."
  },
  "confidence": {
    "level_pct": 60,
    "conviction_pct": 60,
    "conviction_direction": "bullish",
    "data_quality_pct": 100,
    "uncertainty_vectors": []
  },
  "source": {
    "created_by": "ollama/gemma4:26b (aihub)",
    "engine": "ct106-briefing-orchestrator",
    "data_sources": [
      "FRIDAY",
      "yfinance"
    ],
    "note": "Hybrid: Zahlen/Scorecard deterministisch, Prosa via aihub (ollama/gemma4:26b). Prosa ok."
  }
}