{
  "schema_version": "2.0",
  "date": "2026-06-09",
  "briefing_type": "us_daily",
  "language": "de",
  "timezone": "Europe/Zurich",
  "data_classification": "verified-live",
  "market_status": "normal",
  "headline": "Der Markt bewegt sich in einem deutlich risk-off getönten Regime, was durch den signifikanten Rückgang von Rohstoffen und Kryptowährungen belegt wird. Während der Dow mit +0.17% einen leichten Anstieg",
  "market_regime": "Neutral / gemischt",
  "market_moves": {
    "DAX": {
      "value": 24433.0605,
      "change_pct": -0.74,
      "unit": null,
      "note": null
    },
    "ESTX50": {
      "value": 6049.7402,
      "change_pct": -0.21,
      "unit": null,
      "note": null
    },
    "SP500": {
      "value": 7386.6499,
      "change_pct": -0.26,
      "unit": null,
      "note": null
    },
    "Nasdaq100": {
      "value": 29084.5,
      "change_pct": -1.12,
      "unit": null,
      "note": null
    },
    "Dow": {
      "value": 50872.1094,
      "change_pct": 0.17,
      "unit": null,
      "note": null
    },
    "US10Y": {
      "value": 4.528,
      "change_pct": -0.53,
      "unit": "percent",
      "note": null
    },
    "EURUSD": {
      "value": 1.1546,
      "change_pct": 0.2,
      "unit": null,
      "note": null
    },
    "EURCHF": {
      "value": 0.9215,
      "change_pct": 0.42,
      "unit": null,
      "note": null
    },
    "DXY": {
      "value": 99.956,
      "change_pct": -0.09,
      "unit": null,
      "note": null
    },
    "Gold": {
      "value": 4284.8999,
      "change_pct": -1.18,
      "unit": null,
      "note": null
    },
    "Brent": {
      "value": 91.6,
      "change_pct": -2.81,
      "unit": null,
      "note": null
    },
    "WTI": {
      "value": 88.28,
      "change_pct": -3.31,
      "unit": null,
      "note": null
    },
    "BTC": {
      "value": 62167.8086,
      "change_pct": -1.46,
      "unit": null,
      "note": null
    },
    "ETH": {
      "value": 1660.6,
      "change_pct": -1.75,
      "unit": null,
      "note": null
    }
  },
  "scorecard": {
    "europe_tech": {
      "score": 0,
      "interpretation": "DAX -0.74% / ESTX50 -0.21%."
    },
    "us_tech": {
      "score": -1,
      "interpretation": "Nasdaq100 -1.12%."
    },
    "health_rotation": {
      "score": null,
      "interpretation": "Kein Health-Proxy (z.B. XLV) im Snapshot."
    },
    "risk_sentiment": {
      "score": 0,
      "interpretation": "S&P 500 -0.26%."
    },
    "volatility": {
      "score": null,
      "interpretation": "Kein VIX im Snapshot."
    },
    "rates": {
      "score": 1,
      "interpretation": "US10Y -0.53% (steigende Rendite = Gegenwind)."
    },
    "crypto_liquidity": {
      "score": -1,
      "interpretation": "BTC -1.46%."
    }
  },
  "top_themes": [
    {
      "rank": 1,
      "theme": "Sales of million-dollar homes suggest inflation is spurring the wealthy to buy now",
      "mechanism": "Inflation is pulling rich buyers and struggling renters in different directions in housing market.",
      "beneficiaries": [
        "null"
      ],
      "losers": []
    },
    {
      "rank": 2,
      "theme": "BofA reiterates ConAgra stock Underperform rating at $13 target",
      "mechanism": "",
      "beneficiaries": [
        "CAG"
      ],
      "losers": []
    },
    {
      "rank": 3,
      "theme": "Monster Beverage stock hits 52-week high at 90.46 USD",
      "mechanism": "",
      "beneficiaries": [
        "MNST"
      ],
      "losers": []
    }
  ],
  "portfolio_themes": {
    "etfs": null,
    "health_ai": null,
    "tech": null,
    "crypto": null,
    "quality": null,
    "cash": null
  },
  "trigger_calendar": [],
  "positioning": {
    "stance": null,
    "overweight": [],
    "neutral": [],
    "underweight": [],
    "what_not_to_do": null,
    "narrative": "Hypothetisch ist eine Untergewichtung hochspekulativer, zyklischer Assets (wie Kryptowährungen und High-Beta Tech) indiziert. Man sollte defensive Sektoren priorisieren, die weniger anfällig für Commodity-Schocks sind. **Was NICHT tun:** Aufgrund des negativen `crypto_liquidity: -1` Signals und der extremen Schwäche von WTI/Brent ist eine Allokation in rein spekulative oder energieintensive Positionen zu vermeiden."
  },
  "confidence": {
    "level_pct": 10,
    "conviction_pct": 10,
    "conviction_direction": "neutral",
    "data_quality_pct": 100,
    "uncertainty_vectors": []
  },
  "source": {
    "created_by": "jarvis-gemma4:latest",
    "engine": "ct106-briefing-orchestrator",
    "data_sources": [
      "FRIDAY",
      "yfinance"
    ],
    "note": "Hybrid: Zahlen/Scorecard deterministisch, Prosa via lokalem Ollama. Prosa ok."
  }
}