{
  "schema_version": "2.0",
  "date": "2026-06-11",
  "briefing_type": "us_daily",
  "language": "de",
  "timezone": "Europe/Zurich",
  "data_classification": "verified-live",
  "market_status": "normal",
  "headline": "Der US-Markt zeigt eine divergente Struktur, wobei der Nasdaq100 mit -1,12 % deutlich unter Druck gerät, während der Dow Jones mit +0,17 % stabil bleibt. Das Makro-Regime ist von einer leichten Schwäc",
  "market_regime": "Risk-off / Wachstumsangst",
  "market_moves": {
    "DAX": {
      "value": 24195.5,
      "change_pct": -0.97,
      "unit": null,
      "note": null
    },
    "ESTX50": {
      "value": 6034.75,
      "change_pct": -0.25,
      "unit": null,
      "note": null
    },
    "SP500": {
      "value": 7386.6499,
      "change_pct": -0.26,
      "unit": null,
      "note": null
    },
    "Nasdaq100": {
      "value": 29084.5,
      "change_pct": -1.12,
      "unit": null,
      "note": null
    },
    "Dow": {
      "value": 50872.1094,
      "change_pct": 0.17,
      "unit": null,
      "note": null
    },
    "US10Y": {
      "value": 4.528,
      "change_pct": -0.53,
      "unit": "percent",
      "note": null
    },
    "EURUSD": {
      "value": 1.1555,
      "change_pct": 0.17,
      "unit": null,
      "note": null
    },
    "EURCHF": {
      "value": 0.9224,
      "change_pct": 0.07,
      "unit": null,
      "note": null
    },
    "DXY": {
      "value": 99.949,
      "change_pct": 0.04,
      "unit": null,
      "note": null
    },
    "Gold": {
      "value": 4126.1001,
      "change_pct": 0.44,
      "unit": null,
      "note": null
    },
    "Brent": {
      "value": 93.36,
      "change_pct": 0.28,
      "unit": null,
      "note": null
    },
    "WTI": {
      "value": 90.4,
      "change_pct": 0.41,
      "unit": null,
      "note": null
    },
    "BTC": {
      "value": 62714.3906,
      "change_pct": 2.06,
      "unit": null,
      "note": null
    },
    "ETH": {
      "value": 1655.1,
      "change_pct": 2.16,
      "unit": null,
      "note": null
    }
  },
  "scorecard": {
    "europe_tech": {
      "score": -1,
      "interpretation": "DAX -0.97% / ESTX50 -0.25%."
    },
    "us_tech": {
      "score": -1,
      "interpretation": "Nasdaq100 -1.12%."
    },
    "health_rotation": {
      "score": null,
      "interpretation": "Kein Health-Proxy (z.B. XLV) im Snapshot."
    },
    "risk_sentiment": {
      "score": 0,
      "interpretation": "S&P 500 -0.26%."
    },
    "volatility": {
      "score": null,
      "interpretation": "Kein VIX im Snapshot."
    },
    "rates": {
      "score": 1,
      "interpretation": "US10Y -0.53% (steigende Rendite = Gegenwind)."
    },
    "crypto_liquidity": {
      "score": 2,
      "interpretation": "BTC +2.06%."
    }
  },
  "top_themes": [
    {
      "rank": 1,
      "theme": "EnSilica completes tape-out for edge AI chip supply contract",
      "mechanism": "",
      "beneficiaries": [
        "ENSI"
      ],
      "losers": []
    },
    {
      "rank": 2,
      "theme": "Hugo Boss pops 7% after top shareholder Frasers launches $2 billion takeover offer",
      "mechanism": "British retail group Frasers owns a roughly 26% stake in Hugo Boss.",
      "beneficiaries": [
        "BOSS"
      ],
      "losers": []
    },
    {
      "rank": 3,
      "theme": "Barclays cuts Vodafone to “equal weight”on sustained Germany weakness",
      "mechanism": "",
      "beneficiaries": [
        "VOD"
      ],
      "losers": []
    }
  ],
  "portfolio_themes": {
    "etfs": null,
    "health_ai": null,
    "tech": null,
    "crypto": null,
    "quality": null,
    "cash": null
  },
  "trigger_calendar": [],
  "positioning": {
    "stance": null,
    "overweight": [],
    "neutral": [],
    "underweight": [],
    "what_not_to_do": null,
    "narrative": "*(Hypothetische Einschätzung)*\n**Übergewichten:** Krypto-Assets und Rohstoffe (Gold/WTI) zur Absicherung gegen Tech-Volatilität.\n**Neutral:** US-Large-Caps (S&P 500) aufgrund der aktuellen Seitwärtsbewegung.\n**Untergewichten:** US-Tech-Exposure (Nasdaq100) aufgrund des negativen Momentum-Signals.\n**Was NICHT tun:** Keine Long-Positionen in europäischen Tech-Werten eingehen, solange der DAX und ESTX50 die Schwäche nicht abwenden."
  },
  "confidence": {
    "level_pct": 10,
    "conviction_pct": 10,
    "conviction_direction": "neutral",
    "data_quality_pct": 100,
    "uncertainty_vectors": []
  },
  "source": {
    "created_by": "ollama/gemma4:26b (aihub)",
    "engine": "ct106-briefing-orchestrator",
    "data_sources": [
      "FRIDAY",
      "yfinance"
    ],
    "note": "Hybrid: Zahlen/Scorecard deterministisch, Prosa via aihub (ollama/gemma4:26b). Prosa ok."
  }
}